"","subsidiary","contractor","worktype","place","description"
"0","производство электрообеспечения «ямал»","пк форум ооо","кап. строительство","новопортовское нгкм, гтэс нп","работник по при передвижении по территории гтэс оступился и упал."
"2","ао мессояханефтегаз","эриэллнефтегазсервис ооо","бурение","кп 316","сотрудник сторонней организации находился без средств защиты органов зрения (без очков)"
"3","ао мессояханефтегаз","эриэллнефтегазсервис ооо","бурение","кп 316","в зоне шланга высокого давления находился работник"
"4","ооо газпромнефть-хантос","не привлекался","не определена","цднг-1 южно-приобское м/р кп-614 скв.30975","при обходе кп-614 было обнаружен перепад по линейному и затрубному давлению на скв.30975"
"8","тп ханты-мансийск","не привлекался","не определена","южно-приобское м/р 253/42638","всё безопасно"
